date,message
6/12, Usher training document <a href='/annoucements/usher-training.docx'>Download</a>
3/2, Here are some resources that Living Savior Lutheran Church has found to be informative.  These three documents contain useful information and  links to additional resources.</p><ol class='col-md-12 col-md-offset-3'><li><a target='_blank' href='/annoucements/responding-to-coronavirus.pdf'>LCMS SE District letter regarding Corona Virus</a></li><li><a target='_blank' href='/annoucements/the-middle-seat.pdf'>Middle Seat Travel Advice Letter (WSJ)</a></li><li><a target='_blank' href='/annoucements/va-doh.pdf'>Virginia Department of Health letter with helpful advice and important links.</a></li></ol><p>
3/24, <a href='/annoucements/letter-on-egiving.pdf' target='_blank'>Letter on e-giving during Coronavirus outbreak</a>
4/17, <strong>BOSL Announces Virtual Voters’ Assembly on June 7th</strong><br>The Board of Servant Leaders will host a virtual teleconference Voters’ Assembly on Sunday, June 7th at 10am.   An agenda will be sent out with a Zoom invitation two weeks prior to the meeting.  If you are not currently receiving Living Savior Secretary emails and wish to attend, please send an email to Steve Galing, our BOSL Vice President.
4/26, Current state of LSLC. <a href='https://youtu.be/2DlJCJKEsCg' target='_blank'>Please Watch</a>